{
  "schema_version": 1,
  "run_id": "run_018f6b6e-8a2e-7c3a-8b2a-6d1e2f3a4b5c",
  "attempt_id": "att_018f6b6e-8a2e-7c3a-8b2a-6d1e2f3a4b5d",
  "attempt_number": 1,
  "deployment_id": "dep_018f6b6e-8a2e-7c3a-8b2a-6d1e2f3a4b5e",
  "instance_id": "image-agent-a",
  "session_id": "ses_018f6b6e-8a2e-7c3a-8b2a-6d1e2f3a4b5f",
  "generation": 7,
  "fencing_token": 1,
  "state": "issued",
  "transport_profile": "direct",
  "endpoint": "https://runtime.example.invalid/v1/runs",
  "audience": "https://control.example.invalid/deployments/dep_018f6b6e-8a2e-7c3a-8b2a-6d1e2f3a4b5e",
  "lease_expires_at": "2026-09-27T09:01:00Z",
  "created_at": "2026-09-27T09:00:00Z",
  "traceparent": "00-4bf92f3577b34da6a3ce929d0e0e4736-00f067aa0ba902b7-01"
}
